{"$schema":"https://json-schema.org/draft/2020-12/schema","$id":"https://schemas.format-monograph.local/benchmarks/v0412/p3a-c2/benchmark-result.schema.json","title":"P3a-C2 Non-Artifact Benchmark Result Contract","type":"object","additionalProperties":false,"required":["document_kind","contract_version","evidence_kind","benchmark_subject_commit","benchmark_subject_digest","benchmark_subject_digest_basis","subject_manifest","subject_digest_status","benchmark_config_digest","result_digest","result_digest_basis","environment","command_template","parameters","execution_status","composer_terminal_state","overall_gate","stop_reasons","rss_protocol","thresholds","output_json_bytes_basis","input_json_bytes_basis","runs","summary","ratio_evidence","reference_budget"],"properties":{"document_kind":{"const":"p3a_c2_benchmark_result"},"contract_version":{"const":"1.0"},"evidence_kind":{"const":"non_artifact_benchmark"},"benchmark_subject_commit":{"type":"string","pattern":"^[a-f0-9]{40}$"},"benchmark_subject_digest":{"type":"string","pattern":"^sha256:[a-f0-9]{64}$"},"benchmark_subject_digest_basis":{"const":"canonical_subject_manifest_v1"},"subject_manifest":{"type":"array","minItems":1,"uniqueItems":true,"items":{"type":"object","additionalProperties":false,"required":["path","sha256"],"properties":{"path":{"type":"string","minLength":1,"pattern":"^(?!/)(?![A-Za-z]:)(?!.*(?:^|/)\\.\\.(?:/|$))[A-Za-z0-9._/-]+$"},"sha256":{"type":"string","pattern":"^sha256:[a-f0-9]{64}$"}}}},"subject_digest_status":{"type":"object","additionalProperties":false,"required":["state","observed_subject_digest","revalidation_required"],"properties":{"state":{"enum":["current","stale"]},"observed_subject_digest":{"type":"string","pattern":"^sha256:[a-f0-9]{64}$"},"revalidation_required":{"type":"boolean"}}},"benchmark_config_digest":{"type":"string","pattern":"^sha256:[a-f0-9]{64}$"},"result_digest":{"type":"string","pattern":"^sha256:[a-f0-9]{64}$"},"result_digest_basis":{"const":"canonical_json_excluding_result_digest"},"environment":{"type":"object","additionalProperties":false,"required":["os_family","os_build_class","python_version","cpu_architecture","logical_cpu_count","ram_tier"],"properties":{"os_family":{"enum":["windows","linux","macos"]},"os_build_class":{"enum":["public_ci","frozen_reference","unspecified"]},"python_version":{"type":"string","pattern":"^3\\.12\\.[0-9]+$"},"cpu_architecture":{"enum":["x86_64","arm64","other"]},"logical_cpu_count":{"type":"integer","minimum":1,"maximum":1024},"ram_tier":{"enum":["le_8gib","8_to_16gib","16_to_32gib","32_to_64gib","gt_64gib"]}}},"command_template":{"type":"string","minLength":1,"maxLength":500,"not":{"pattern":"(?:[A-Za-z]:[\\\\/]|/(?:home|Users|tmp)/)"}},"parameters":{"type":"object","additionalProperties":false,"required":["scale_id","scenario_id","measurement_kind","generation_seed","permutation_seed"],"properties":{"scale_id":{"enum":["0.5x","1.0x","1.5x","2.0x"]},"scenario_id":{"enum":["disjoint","subset-chain","dense-crossing","mixed-conflict-approval"]},"measurement_kind":{"enum":["coverage","performance","determinism"]},"generation_seed":{"type":"integer","minimum":0},"permutation_seed":{"type":["integer","null"],"minimum":0}}},"execution_status":{"enum":["completed","stopped"]},"composer_terminal_state":{"enum":["final","unresolvable","awaiting_approval","not_reached"]},"overall_gate":{"enum":["go","stop"]},"stop_reasons":{"type":"array","uniqueItems":true,"items":{"enum":["threshold_exceeded","wall_ratio_exceeded","rss_ratio_exceeded","output_ratio_exceeded","timeout","process_crash","rss_unavailable","coverage_conservation_failure","stable_id_drift","canonical_nondeterminism","fingerprint_nondeterminism","terminal_state_mismatch","subject_stale","contract_error","reference_budget_exceeded"]}},"rss_protocol":{"type":"object","additionalProperties":false,"required":["measurement_method","sampling_interval_seconds","child_process_scope","record_baseline","record_delta","unavailable_policy","delta_rounding"],"properties":{"measurement_method":{"const":"external_supervisor_child_peak_working_set"},"sampling_interval_seconds":{"const":0.05},"child_process_scope":{"const":"benchmark_child_process_only"},"record_baseline":{"const":true},"record_delta":{"const":true},"unavailable_policy":{"const":"fail_closed"},"delta_rounding":{"const":"mib_3_decimal_places_half_even"}}},"thresholds":{"type":"object","additionalProperties":false,"required":["scale_limits","wall_median_ratio_2x_to_1x","rss_ratio_2x_to_1x","output_json_ratio_2x_to_1x"],"properties":{"scale_limits":{"type":"array","minItems":4,"maxItems":4,"items":false,"prefixItems":[{"allOf":[{"type":"object","additionalProperties":false,"required":["scale_id","max_wall_seconds","max_peak_rss_mib"],"properties":{"scale_id":{"enum":["0.5x","1.0x","1.5x","2.0x"]},"max_wall_seconds":{"type":"number","exclusiveMinimum":0},"max_peak_rss_mib":{"type":"integer","minimum":1}}},{"properties":{"scale_id":{"const":"0.5x"},"max_wall_seconds":{"const":60},"max_peak_rss_mib":{"const":512}}}]},{"allOf":[{"type":"object","additionalProperties":false,"required":["scale_id","max_wall_seconds","max_peak_rss_mib"],"properties":{"scale_id":{"enum":["0.5x","1.0x","1.5x","2.0x"]},"max_wall_seconds":{"type":"number","exclusiveMinimum":0},"max_peak_rss_mib":{"type":"integer","minimum":1}}},{"properties":{"scale_id":{"const":"1.0x"},"max_wall_seconds":{"const":60},"max_peak_rss_mib":{"const":512}}}]},{"allOf":[{"type":"object","additionalProperties":false,"required":["scale_id","max_wall_seconds","max_peak_rss_mib"],"properties":{"scale_id":{"enum":["0.5x","1.0x","1.5x","2.0x"]},"max_wall_seconds":{"type":"number","exclusiveMinimum":0},"max_peak_rss_mib":{"type":"integer","minimum":1}}},{"properties":{"scale_id":{"const":"1.5x"},"max_wall_seconds":{"const":60},"max_peak_rss_mib":{"const":512}}}]},{"allOf":[{"type":"object","additionalProperties":false,"required":["scale_id","max_wall_seconds","max_peak_rss_mib"],"properties":{"scale_id":{"enum":["0.5x","1.0x","1.5x","2.0x"]},"max_wall_seconds":{"type":"number","exclusiveMinimum":0},"max_peak_rss_mib":{"type":"integer","minimum":1}}},{"properties":{"scale_id":{"const":"2.0x"},"max_wall_seconds":{"const":120},"max_peak_rss_mib":{"const":1024}}}]}]},"wall_median_ratio_2x_to_1x":{"const":6},"rss_ratio_2x_to_1x":{"const":3},"output_json_ratio_2x_to_1x":{"const":3}}},"output_json_bytes_basis":{"const":"canonical_composition_report_plus_final_profile_if_present_v1"},"input_json_bytes_basis":{"const":"canonical_benchmark_input_json_v1"},"runs":{"type":"array","maxItems":16,"items":{"type":"object","additionalProperties":false,"required":["run_index","run_kind","run_status","timings","rss","input_json_bytes","output_json_bytes","metrics","terminal_state","terminal_trace","coverage_conservation","stable_id_status","canonical_determinism","fingerprint_determinism","contract_status","final_profile_present","final_profile_fingerprint"],"properties":{"run_index":{"type":"integer","minimum":1},"run_kind":{"enum":["coverage","performance_warmup","performance_measured","determinism"]},"run_status":{"enum":["completed","timeout","process_crash"]},"timings":{"type":"object","additionalProperties":false,"required":["synthetic_generation","schema_registry_validation","compose","approval_generation","apply","canonical_serialization","end_to_end"],"properties":{"synthetic_generation":{"oneOf":[{"type":"object","additionalProperties":false,"required":["status","wall_seconds"],"properties":{"status":{"const":"measured"},"wall_seconds":{"type":"number","minimum":0}}},{"type":"object","additionalProperties":false,"required":["status"],"properties":{"status":{"const":"not_applicable"}}}]},"schema_registry_validation":{"oneOf":[{"type":"object","additionalProperties":false,"required":["status","wall_seconds"],"properties":{"status":{"const":"measured"},"wall_seconds":{"type":"number","minimum":0}}},{"type":"object","additionalProperties":false,"required":["status"],"properties":{"status":{"const":"not_applicable"}}}]},"compose":{"oneOf":[{"type":"object","additionalProperties":false,"required":["status","wall_seconds"],"properties":{"status":{"const":"measured"},"wall_seconds":{"type":"number","minimum":0}}},{"type":"object","additionalProperties":false,"required":["status"],"properties":{"status":{"const":"not_applicable"}}}]},"approval_generation":{"oneOf":[{"type":"object","additionalProperties":false,"required":["status","wall_seconds"],"properties":{"status":{"const":"measured"},"wall_seconds":{"type":"number","minimum":0}}},{"type":"object","additionalProperties":false,"required":["status"],"properties":{"status":{"const":"not_applicable"}}}]},"apply":{"oneOf":[{"type":"object","additionalProperties":false,"required":["status","wall_seconds"],"properties":{"status":{"const":"measured"},"wall_seconds":{"type":"number","minimum":0}}},{"type":"object","additionalProperties":false,"required":["status"],"properties":{"status":{"const":"not_applicable"}}}]},"canonical_serialization":{"oneOf":[{"type":"object","additionalProperties":false,"required":["status","wall_seconds"],"properties":{"status":{"const":"measured"},"wall_seconds":{"type":"number","minimum":0}}},{"type":"object","additionalProperties":false,"required":["status"],"properties":{"status":{"const":"not_applicable"}}}]},"end_to_end":{"oneOf":[{"type":"object","additionalProperties":false,"required":["status","wall_seconds"],"properties":{"status":{"const":"measured"},"wall_seconds":{"type":"number","minimum":0}}},{"type":"object","additionalProperties":false,"required":["status"],"properties":{"status":{"const":"not_applicable"}}}]}}},"rss":{"oneOf":[{"type":"object","additionalProperties":false,"required":["status","baseline_rss_mib","peak_rss_mib","delta_peak_rss_mib"],"properties":{"status":{"const":"available"},"baseline_rss_mib":{"type":"number","minimum":0},"peak_rss_mib":{"type":"number","minimum":0},"delta_peak_rss_mib":{"type":"number","minimum":0}}},{"type":"object","additionalProperties":false,"required":["status"],"properties":{"status":{"const":"unavailable"}}}]},"input_json_bytes":{"type":["integer","null"],"minimum":0},"output_json_bytes":{"type":["integer","null"],"minimum":0},"metrics":{"oneOf":[{"type":"object","additionalProperties":false,"required":["input_asset_count","input_rule_count","input_binding_count","expected_key_count","candidate_count","candidate_group_count","partition_count","conflict_count","proposal_count","blocker_count","max_candidates_per_key","max_partition_width","max_repartition_depth"],"properties":{"input_asset_count":{"type":"integer","minimum":0},"input_rule_count":{"type":"integer","minimum":0},"input_binding_count":{"type":"integer","minimum":0},"expected_key_count":{"type":"integer","minimum":0},"candidate_count":{"type":"integer","minimum":0},"candidate_group_count":{"type":"integer","minimum":0},"partition_count":{"type":"integer","minimum":0},"conflict_count":{"type":"integer","minimum":0},"proposal_count":{"type":"integer","minimum":0},"blocker_count":{"type":"integer","minimum":0},"max_candidates_per_key":{"type":"integer","minimum":0},"max_partition_width":{"type":"integer","minimum":0},"max_repartition_depth":{"type":"integer","minimum":0}}},{"type":"null"}]},"terminal_state":{"enum":["final","unresolvable","awaiting_approval","not_reached"]},"terminal_trace":{"type":"object","additionalProperties":false,"required":["pre_approval","post_approval"],"properties":{"pre_approval":{"enum":["final","unresolvable","awaiting_approval","not_reached","not_applicable"]},"post_approval":{"enum":["final","unresolvable","awaiting_approval","not_reached","not_applicable"]}}},"coverage_conservation":{"enum":["passed","failed","not_reached"]},"stable_id_status":{"enum":["stable","drift","not_reached"]},"canonical_determinism":{"enum":["matched","mismatched","not_applicable","not_reached"]},"fingerprint_determinism":{"enum":["matched","mismatched","not_applicable","not_reached"]},"contract_status":{"enum":["valid","error"]},"final_profile_present":{"type":"boolean"},"final_profile_fingerprint":{"oneOf":[{"type":"string","pattern":"^sha256:[a-f0-9]{64}$"},{"type":"null"}]}}}},"summary":{"oneOf":[{"type":"null"},{"type":"object","additionalProperties":false,"required":["median_wall_seconds","max_wall_seconds","median_peak_rss_mib","max_peak_rss_mib","median_output_json_bytes","max_output_json_bytes"],"properties":{"median_wall_seconds":{"type":"number","minimum":0},"max_wall_seconds":{"type":"number","minimum":0},"median_peak_rss_mib":{"type":"number","minimum":0},"max_peak_rss_mib":{"type":"number","minimum":0},"median_output_json_bytes":{"type":"integer","minimum":0},"max_output_json_bytes":{"type":"integer","minimum":0}}}]},"ratio_evidence":{"type":"object","additionalProperties":false,"required":["wall","rss","output_json"],"properties":{"wall":{"oneOf":[{"type":"object","additionalProperties":false,"required":["status"],"properties":{"status":{"const":"not_applicable"}}},{"type":"object","additionalProperties":false,"required":["status","baseline_1x","observed_2x","ratio"],"properties":{"status":{"const":"measured"},"baseline_1x":{"type":"number","exclusiveMinimum":0},"observed_2x":{"type":"number","minimum":0},"ratio":{"type":"number","minimum":0}}}]},"rss":{"oneOf":[{"type":"object","additionalProperties":false,"required":["status"],"properties":{"status":{"const":"not_applicable"}}},{"type":"object","additionalProperties":false,"required":["status","baseline_1x","observed_2x","ratio"],"properties":{"status":{"const":"measured"},"baseline_1x":{"type":"number","exclusiveMinimum":0},"observed_2x":{"type":"number","minimum":0},"ratio":{"type":"number","minimum":0}}}]},"output_json":{"oneOf":[{"type":"object","additionalProperties":false,"required":["status"],"properties":{"status":{"const":"not_applicable"}}},{"type":"object","additionalProperties":false,"required":["status","baseline_1x","observed_2x","ratio"],"properties":{"status":{"const":"measured"},"baseline_1x":{"type":"number","exclusiveMinimum":0},"observed_2x":{"type":"number","minimum":0},"ratio":{"type":"number","minimum":0}}}]}}},"reference_budget":{"type":"object","additionalProperties":false,"required":["elapsed_hours","limit_hours"],"properties":{"elapsed_hours":{"type":"number","minimum":0},"limit_hours":{"const":3}}}}}
