{"document_kind":"p3a_c2_benchmark_result","contract_version":"1.0","evidence_kind":"non_artifact_benchmark","benchmark_subject_commit":"0123456789abcdef0123456789abcdef01234567","benchmark_subject_digest":"sha256:66e5c36210c6f146c6cd393c38a4cc67bf62fe9ec56a9923c516417762496730","benchmark_subject_digest_basis":"canonical_subject_manifest_v1","subject_manifest":[{"path":"format-monograph/scripts/profile_v2_benchmark.py","sha256":"sha256:1111111111111111111111111111111111111111111111111111111111111111"},{"path":"format-monograph/scripts/profile_v2_composer.py","sha256":"sha256:2222222222222222222222222222222222222222222222222222222222222222"}],"subject_digest_status":{"state":"current","observed_subject_digest":"sha256:66e5c36210c6f146c6cd393c38a4cc67bf62fe9ec56a9923c516417762496730","revalidation_required":false},"benchmark_config_digest":"sha256:23ef133290afe59c4c40258fcdc81b2a9d93b34a2cce341585b30cb747b65ec9","result_digest":"sha256:b6ecdf5c4b19cc4f5f6c47e5e6db569ebbdc535c1c5898fc3429fa69c0fcc6bb","result_digest_basis":"canonical_json_excluding_result_digest","environment":{"os_family":"windows","os_build_class":"frozen_reference","python_version":"3.12.13","cpu_architecture":"x86_64","logical_cpu_count":8,"ram_tier":"16_to_32gib"},"command_template":"python -m internal_benchmark --config benchmark-config.json","parameters":{"scale_id":"1.5x","scenario_id":"disjoint","measurement_kind":"performance","generation_seed":41,"permutation_seed":null},"execution_status":"completed","composer_terminal_state":"final","overall_gate":"go","stop_reasons":[],"rss_protocol":{"measurement_method":"external_supervisor_child_peak_working_set","sampling_interval_seconds":0.05,"child_process_scope":"benchmark_child_process_only","record_baseline":true,"record_delta":true,"unavailable_policy":"fail_closed","delta_rounding":"mib_3_decimal_places_half_even"},"thresholds":{"scale_limits":[{"scale_id":"0.5x","max_wall_seconds":60,"max_peak_rss_mib":512},{"scale_id":"1.0x","max_wall_seconds":60,"max_peak_rss_mib":512},{"scale_id":"1.5x","max_wall_seconds":60,"max_peak_rss_mib":512},{"scale_id":"2.0x","max_wall_seconds":120,"max_peak_rss_mib":1024}],"wall_median_ratio_2x_to_1x":6,"rss_ratio_2x_to_1x":3,"output_json_ratio_2x_to_1x":3},"output_json_bytes_basis":"canonical_composition_report_plus_final_profile_if_present_v1","input_json_bytes_basis":"canonical_benchmark_input_json_v1","runs":[{"run_index":1,"run_kind":"performance_warmup","run_status":"completed","timings":{"synthetic_generation":{"status":"measured","wall_seconds":0.01},"schema_registry_validation":{"status":"measured","wall_seconds":0.02},"compose":{"status":"measured","wall_seconds":0.1},"approval_generation":{"status":"not_applicable"},"apply":{"status":"measured","wall_seconds":0.04},"canonical_serialization":{"status":"measured","wall_seconds":0.02},"end_to_end":{"status":"measured","wall_seconds":0.45}},"rss":{"status":"available","baseline_rss_mib":20.0,"peak_rss_mib":29,"delta_peak_rss_mib":9.0},"input_json_bytes":800,"output_json_bytes":1200,"metrics":{"input_asset_count":1,"input_rule_count":2,"input_binding_count":3,"expected_key_count":4,"candidate_count":5,"candidate_group_count":6,"partition_count":7,"conflict_count":8,"proposal_count":9,"blocker_count":10,"max_candidates_per_key":11,"max_partition_width":12,"max_repartition_depth":13},"terminal_state":"final","terminal_trace":{"pre_approval":"final","post_approval":"not_applicable"},"coverage_conservation":"passed","stable_id_status":"stable","canonical_determinism":"not_applicable","fingerprint_determinism":"not_applicable","contract_status":"valid","final_profile_present":true,"final_profile_fingerprint":"sha256:dddddddddddddddddddddddddddddddddddddddddddddddddddddddddddddddd"},{"run_index":2,"run_kind":"performance_measured","run_status":"completed","timings":{"synthetic_generation":{"status":"measured","wall_seconds":0.01},"schema_registry_validation":{"status":"measured","wall_seconds":0.02},"compose":{"status":"measured","wall_seconds":0.1},"approval_generation":{"status":"not_applicable"},"apply":{"status":"measured","wall_seconds":0.04},"canonical_serialization":{"status":"measured","wall_seconds":0.02},"end_to_end":{"status":"measured","wall_seconds":0.3}},"rss":{"status":"available","baseline_rss_mib":20.0,"peak_rss_mib":30,"delta_peak_rss_mib":10.0},"input_json_bytes":800,"output_json_bytes":1200,"metrics":{"input_asset_count":1,"input_rule_count":2,"input_binding_count":3,"expected_key_count":4,"candidate_count":5,"candidate_group_count":6,"partition_count":7,"conflict_count":8,"proposal_count":9,"blocker_count":10,"max_candidates_per_key":11,"max_partition_width":12,"max_repartition_depth":13},"terminal_state":"final","terminal_trace":{"pre_approval":"final","post_approval":"not_applicable"},"coverage_conservation":"passed","stable_id_status":"stable","canonical_determinism":"not_applicable","fingerprint_determinism":"not_applicable","contract_status":"valid","final_profile_present":true,"final_profile_fingerprint":"sha256:dddddddddddddddddddddddddddddddddddddddddddddddddddddddddddddddd"},{"run_index":3,"run_kind":"performance_measured","run_status":"completed","timings":{"synthetic_generation":{"status":"measured","wall_seconds":0.01},"schema_registry_validation":{"status":"measured","wall_seconds":0.02},"compose":{"status":"measured","wall_seconds":0.1},"approval_generation":{"status":"not_applicable"},"apply":{"status":"measured","wall_seconds":0.04},"canonical_serialization":{"status":"measured","wall_seconds":0.02},"end_to_end":{"status":"measured","wall_seconds":0.4}},"rss":{"status":"available","baseline_rss_mib":20.0,"peak_rss_mib":31,"delta_peak_rss_mib":11.0},"input_json_bytes":800,"output_json_bytes":1200,"metrics":{"input_asset_count":1,"input_rule_count":2,"input_binding_count":3,"expected_key_count":4,"candidate_count":5,"candidate_group_count":6,"partition_count":7,"conflict_count":8,"proposal_count":9,"blocker_count":10,"max_candidates_per_key":11,"max_partition_width":12,"max_repartition_depth":13},"terminal_state":"final","terminal_trace":{"pre_approval":"final","post_approval":"not_applicable"},"coverage_conservation":"passed","stable_id_status":"stable","canonical_determinism":"not_applicable","fingerprint_determinism":"not_applicable","contract_status":"valid","final_profile_present":true,"final_profile_fingerprint":"sha256:dddddddddddddddddddddddddddddddddddddddddddddddddddddddddddddddd"},{"run_index":4,"run_kind":"performance_measured","run_status":"completed","timings":{"synthetic_generation":{"status":"measured","wall_seconds":0.01},"schema_registry_validation":{"status":"measured","wall_seconds":0.02},"compose":{"status":"measured","wall_seconds":0.1},"approval_generation":{"status":"not_applicable"},"apply":{"status":"measured","wall_seconds":0.04},"canonical_serialization":{"status":"measured","wall_seconds":0.02},"end_to_end":{"status":"measured","wall_seconds":0.5}},"rss":{"status":"available","baseline_rss_mib":20.0,"peak_rss_mib":32,"delta_peak_rss_mib":12.0},"input_json_bytes":800,"output_json_bytes":1200,"metrics":{"input_asset_count":1,"input_rule_count":2,"input_binding_count":3,"expected_key_count":4,"candidate_count":5,"candidate_group_count":6,"partition_count":7,"conflict_count":8,"proposal_count":9,"blocker_count":10,"max_candidates_per_key":11,"max_partition_width":12,"max_repartition_depth":13},"terminal_state":"final","terminal_trace":{"pre_approval":"final","post_approval":"not_applicable"},"coverage_conservation":"passed","stable_id_status":"stable","canonical_determinism":"not_applicable","fingerprint_determinism":"not_applicable","contract_status":"valid","final_profile_present":true,"final_profile_fingerprint":"sha256:dddddddddddddddddddddddddddddddddddddddddddddddddddddddddddddddd"}],"summary":{"median_wall_seconds":0.4,"max_wall_seconds":0.5,"median_peak_rss_mib":31,"max_peak_rss_mib":32,"median_output_json_bytes":1200,"max_output_json_bytes":1200},"ratio_evidence":{"wall":{"status":"not_applicable"},"rss":{"status":"not_applicable"},"output_json":{"status":"not_applicable"}},"reference_budget":{"elapsed_hours":0.01,"limit_hours":3}}
